2	1	a	Decent-ish. Difficult to recommend one way or the other. Poor resolution and gamepad support, but the basic gameplay is some fun starfox-like business. It's quite pretty, although the gameplay is not quite as nuanced as its contemporaries (sin and punishment 2?).  Still, compared to Yar's Revenge, Aces of the Galaxy is good, and might be the best on-rails shmups on Steam, if that's your fancy.
5045	1	a	I like previous Puzzler World more than this one. Game interface feels like it's lazy port from tablet version. But Colour-in game is nice and I got the game for cheap so I don't complain much. It is on sale very often too.   For Achievement hunter:  100% - You play each type of puzzle 10 times. Getting All Achievement from Bonus Puzzle games can be a bit annoying because one main puzzle will lead to one of the two bonus puzzles. For example, after you finished Sudoku puzzle, it's bonus game will be either Sum-up or Add-up bonus game. You can check the guide so you won't waste too much time completing main puzzle. 
1738	1	a	It was great fun playing with friends. I recommend you buy the 4 pack! It's especially fun when someone messes up, everyone starts to panic!
1485	1	a	Monaco: What's Yours is Mine is one of my favorite games. I just want to start with that. I got this game a couple months ago and I'm hooked. Yeah, it's a little frustrating at times, but only in that sort of 'Aargh I'm not quite good enough for this level!' way. Monaco is kind of a fun time-waster singleplayer, but where it really shines is multiplayer. It is FANTASTIC, and not just for the sake of completion. It's so much fun to run through the levels, causing chaos, or try to not get spotted at all. Make sure you discuss your plans with other players, but don't be surprised when things fall apart because of an unlucky corner with five guards behind it. The way powers help your friends makes the teamwork element of this game happen so naturally you might not even realize you're doing it at first. The hacker runs through a hallway trailing viruses, and the laser grid in your way just dies. The Mole digs a tunnel, and you escape through it to a nearby shrub. And everyone loves a Lookout. If there's one character who doesn't play well with teams, it's the Pickpocket, whose power is purely self-focused and who tends to hoard all the coins. If everyone's okay with that, by all means, play him. But if you're just browsing for random games online, it's polite to not use the pickpocket. The difficulty wobbles a bit around the start of the second act, but it pretty much goes steadily up from there. And keeps going up. This works to the game's advantage. The difficulty curve gives you enough time to get used to the system, and then slowly works in new elements and characters, and by the time you're dealing with the really hard stuff, you've got at least an idea of what to do. You may not be able to do it on your first try, or even your first ten, but you should be able to understand at least the theory of how the pieces fit together. Replay value? The game has incredible replay value. Not only are there eight characters to play through with, but there's an entire community of fan-made maps to play, and once you've done all the main story, there's even a zombie mode for more violent fun! I've already beaten the main story, and I'm working my way through the stunningly difficult final campain, 'Fin'. I am curious how they might expand the story that I thought was over, but it seems to be a well-written wrap-up. The story is simple, but has a few twists to make it more satisfying. Without spoiling too much, I will say that I would have been satisfied with the game if it had concluded with 'Identity'. The two (much shorter) extra acts were icing on the cake. It's a pretty standard heist plot, with a little bit of 'how we got here' thrown in, betrayals, and other standard tropes of the genre, but it managed to surprise me in places, which made me very happy. It's not often you get to play a mystery from the villain's perspective and still be surprised. If I'm ambivalent about only one aspect, it would be the artstyle. The sprites are charming, but it's really quite difficut to tell who's who at times, and for colorblind players, this would be completely incomprehensible. Everyone looks like squares, including the enemies. The top-down angle limits the perspective, but the backgrounds do not suffer from the same confusion as the characters. They are gorgeous, elaborate, and the way lighting is used is something I've never seen in another stealth game. In some of the levels, I can even look down through the floor to see bits of the lower areas. The music is amazing, but since the levels can be a bit long, it loops a lot. It's by no means grating, and it spreads the clips out with slow, quiet periods, so it doesn't get stuck in your head too often, but it could have used a little variety. I loved the musical cues for when someone got spotted or an objective was completed, though. All in all, a fantastic game, and one that I'd readily recommend to anyone who likes stealth games, co-op games, or mysteries. Singleplayer: 3/5. A little tedious, but fun and challenging. Multiplayer: 5/5. The game's strongest point. One of the best co-op experiences I've ever had. Art: 3/5. The sprites were limited, but the settings were gorgeous. Sound: 4/5. The music was excellent, and I wish there had been more variety to it. The voices of the characters were delightful, even if I couldn't understand a word of french. Difficulty: 4/5. Quite a challenge, but not so difficult you become disenchanted. You learn and get better noticably over time. Replay: 5/5. Many levels, community-made maps, and excellent multiplayer. The end is just the beginning.
2036	1	a	What's yours is mine. My virginity is no ones.
3424	1	a	This is one of the few games I've played through multiple times and enjoyed the ride each trip.  It's a short, turn based RPG with quirky characters, Psychonaut-esque graphics (yay, Double Fine!), and a fairly entertaining story.  The combat system isn't all that exciting and if you're a person that doesn't like to switch between costumes/character builds, odds are it'll grow tiresome quickly.  Still though - if you like Double Fine, weird characters, good humor, and decent gameplay, you can't go wrong.
2190	1	a	Tons of fun with friends!
518	1	a	My group of friends is very into board games, however we live hundreds of miles away from each other. Therefore, Ticket to Ride seemed like a good idea (and it was). I will say that interface-wise, what you see is what you get: it is a true-as-can-be replication of the board game with a little bit of sound. After some initial futzing around, the game client is relatively easy to operate. Joining games can be a little odd, and because the game was designed for mobile devices, clicking can be a bit off at times (CTRL acts as a drag or double click or something). Given these minor bugs, being able to play a board game with friends faraway is a win in my book, even if the controls lag out once in a while. At the end of the day, the game is solid and does what it should. Plus, it has a wistful harmonica melody that will haunt your dreams while adding atmosphere to your game about railroads!  PROS: stays true to it's physical counterpart, online play, no sorting of little plastic trains! CONS: wonky controls, more misclicks than I would like
827	0	a	This is a very faithful recreation of the Boardgame. I would, however much rather play the boardgame or at least the tablet version with pass and play. It turns out that TTR isn't really all that captivating without other people around.
5174	1	a	Do you like to dig?  Oh of course you do, you are a dwarf! This game brings the dwarf life.... well, to life! Mine, build, survive, and thrive. Fun to play and find all sorts of hidden treasures far underground in your mines.  If you like a simple dwarf colony game with mining, building, gathering, farming, and much much more. Check this one out as you won't be disappointed.
1116	0	a	'It's like Trials with animals' -IGN    Neh, 1/10
5423	1	a	simple, fun, not easy, but not impossible!! how fast are your fingers? this takes space invaders to a whole new level....im glad this is in my library!
4298	1	a	It's a clone of Katamari, but it's charming, easy to play, perfect for casual pick-up-and-play gaming, and contains references to Discworld and Blues Brothers. Hard to dislike.
1713	1	a	As many people have said, if you look at the disrecommendations, this game is very easy and boring. However, what those people fail to realize is that, they didn't try hard enough. This game is so boring and simple if you just run through, grab the objectives, and dodge bullets. Now, on the other hand, if you actually go for the achievements, try sneaking through undetected, getting every coin, and not dying, it quickly becomes very difficult and fun. Several people have stated it lacks challenge and strategizing, but that's probably because they played the first levels designed for newcomers, and didn't even try to do good. My friend and I played through the entire game, getting every trophy and achievement, including a hidden one, and it was not easy at several points. For example, in one level, guards spawn every 20 seconds, and form giant conga lines of destruction. Now try sneaking past their unpredictable routes into a guarded room, knocking out the guards without getting seen, so that you can hack a computer and hope that everything works out to let you get through the other 2 rooms, past some lasers, and giving you enough time to grab the cash and get out. My friend and I got rather good at the game and it took us about 30 tries to get lucky on that level. This game has tons of gameplay, and even more replayability with the many character combinations and strategies you can use on each level. I highly recommend this game to anyone.
3163	0	a	I really want to recommend this game, but I can't. The physics are B-A-D. You do the same action over and over again and the result is different every â¥â¥â¥â¥ing single time, until the game itself decides that you can finally proceed after all this torture. It's buggy at some stages and that 'it's all about the timing' thing, is so frustrating, because you can totally miss the target for miliseconds of delay. Don't get me wrong though, it's a fun game to play and very challeging.  5.5/10
589	1	a	This is a faithful, well-programmed, easy to play version of the amazing board game. You can play with multiple people on the computer, AI opponents, and even human players over the internet.   This version has a TON of maps to play as well. US, US Big Cities, US 1919 (or something like that), Europe, Legendary Asia, Swiss, and I think one other.The only one that I've noticed isn't there is the German one with the travelers. Otherwise, this board game is the whole package.  If you're a fan of this board game, or even board games in general, pick it up. I'm more than happy with my purchase.
5400	1	a	Simple fun... I did not expect much but at 50+ hours of gameplay it was worth the money (try to catch on sale).
5213	1	a	A fantastic, lighthearted, open-world (ala Metroid) puzzle adventure game. No hand-holding; rather than granting you new abilities, you start with everything you need to solve every puzzle from the beginning, learning new ways of interacting with what's around you as you go. A game that's hard not to love; highly recommended.
609	1	a	Love this game, but I can't log into the online features! Please fix this!
2115	1	a	Really nice game to play with your friends :)
2499	1	a	This game is amazing. I love it so much. It makes you feel like you are really a criminal. I loved going through the storyline running for my life as hundreds of cops chase me and I am scared so bad.
3037	1	a	this is addicting game!
1952	1	a	Monaco is a great stealth action-packed game. You take the role of 8 different thieves with very different gameplay through two campaigns and great number of challenges. The gameplay is solid. While you can pretty much force your way through the first levels, you really must avoid getting caught later on. The difficulty of the second campaign is quite hard, with a lot of achivements to go for. While the game is great in solo, it really shines in coop multiplayer, where each player control a different thief. There's also versus multiplayer, which is great fun too.   Monaco also has a very fitting soundtrack and a very interesting storyline, mostly because of the way it is told. For those interested, there's also a great deal of community maps made with the very complete level editor in the game. The game recently recieved an update consisting of a reworked campaign and a zombie mode with new enemies.   If you like stealth games, monaco really is a blast. I especially recommend it if you can find friends to play with.
824	1	a	I've played way too much of this 10/10
2481	1	a	This is a very fun game. Very much like an 8-bit Pay-Day. It's a fun heist game and playing online, you never know, who you're going to meet and be friends with forever.
2467	1	a	It's a great game especially for the price Friends I have two copies if you want. Only downside is you have to play with other people. You're supposed to have 4 but 3 would do.
5128	0	a	I can NOT recommend getting this game, I got it for free and have been playing it quite a bit just because its somewhat similar to Dungeon Keeper, then i played it because I wanted to be finished with it, and just now I ragequitted because a dwarf starved to death and the first audio queue I got about it was when he died.  Its ugly as hell. It lacks challenge. Its extremely time-consuming.  I still wanna finish it because its made by Swedish devs, but I cant recommend it to anyone.  If youre German you might enjoy it, but id rather point you in the direction of Dungeon Keeper.
4696	1	a	It's kinda like portal, except without portals, and longer.
5427	1	a	A reboot of the old arcade style games. Titan Attacks really delivers on it's simple form of fun with great music and visuals.
3083	1	a	Freaking awesome game. Simple but very fun, do-able as a 2 person game so great for couples, also works with the full party but co-operation is required.
3501	1	a	I love this game! Its cute, Its funny, and just plan FUN! Not to hard for kids and just fun and funny for adults!  I recommend this game WHOLE HEARTEDLY!
3959	0	a	Fun at first but then becomes very repetitive. The game isn't all bad it deffinitly gets points for style and writing. If there was a little more depth and less repetitive this could be a better game. Stopped playing when I realized I was doing the same thing over and over.
4507	1	a	I always wondered what it would be like to grow pot. Thanks to Plant Tycoon, I was able to realize the financial possibilities and explore myself during a time of identity crisis. Thank you, Plant Tycoon. I would definitely recommend this simulator to anybody considering producing illicit products as a living.
969	0	a	The game is too short and the story is totally dull. The hidden object scenes are ok, but the rest of the game is fogettable. Don't bother with this one, you can play The Clockwork Man: The Hidden World though - it's much much better.
5398	1	a	Buy? Yes. A short and too the point arcade action title inspired by Space Invaders and Heavy Weapon. Lovable art style and rewarding gameplay. Nice little title to finish in a few hours.
64	1	a	Lume is a little game, packed with several puzzles that you must solve. It took some time to get them all solved and some of them are quite tricky (especially the second locker). What I found the most interesting is the design: Lume is an indie game to behold, made for those who cares about aesthetics more than anything else. After installing and entering the game, my first reaction was 'you must be kidding me', because everything is filmed, all the scenario is handmade and the soundtrack is immersive...  It's a short game and, definitely, a beautiful revival of the adventure/point-and-click genre. I spent just Â¥299, after looking for some indie games with the same vibe of those made by Amanita Design (Machinarium, Botanicula, Samorost 2). If you like Indie Games, Puzzle, Adventure/Point-and-click and, most of all, you enjoy the art and music, Lume is a nice one. Already getting ready for Lumino City.
882	0	a	Don't play this game. The dice always are in favor of the AI if you play solo You will lose without any reasonable chance.
1565	1	a	This game is great if you want to do something with your friends. It has amzaing gameplay that is well balanced, and lots of fun missions that gives plenty hours of fun.
4402	1	a	It's a great short trip, when you need a Katamari kick. Give it a try, but keep your expectations low as the worlds are not huge, but they're still a blast to play though.
3364	1	a	Costume Quest is one of those games that you get from a bundle and it just sits in your library for months on end. That happened to me and then I thought that I should probably play the game. So I did and I found it to be an immersive RPG that should not be over looked. The whole concept of this game is great its something original combining turn based strategy with humour and Halloween. It is something that is definitely worth playing.
3302	1	a	When monsters invade to disrupt the sacred trick-or-treating tradition of Halloween, kidnap your twin, and attempt to steal all the candy that is yours by right, there's nothing to do but turn your costume up to eleven and kick them back into the netherworld from whence they came. Thus is the setup to Costume Quest, a hilarious and creative RPG-lite from Double Fine that is as sweet as the candy you so eagerly collect, despite its gameplay being highly simplified.  You spend most of your time exploring the world, collecting costume pieces, and of course knocking on houses with the hope that a bundle of candy will be waiting for you on the other side. There are also a handful of side-quests to complete, most in the form of hide-and-seek games or typical fetching errands. Though in most games I find quests such as these mundane and uninteresting, here they are full of so much humor and charm that it was hard for me to keep from smiling the whole way through.  But supposing someone not so nice and full of candy answers the door, then it's time to for some Persona like turn-based combat to occur. This is where gameplay hits a snag, as while fully functional the battle mechanics are extremely basic, revolving almost entirely around quicktime events with little to no variation or strategy to speak of. They are also terribly easy (I failed all but once, and on the final boss no less) which made the few options you are given for altering your character's attacks even less noticeable and necessary. That's not to say battles are completely devoid of fun, as I did enjoy them to an extent, but after only a few hours the repetition becomes grating so much as to have me actively try and avoid encounters (as if the Ninja costume wasn't already awesome enough). Thankfully with the story clocking in at 6-7 hours, it never got so bad as to greatly degrade the experience, and so long as you keep play sessions to short bursts are little more than a minor annoyance.  The big head celshaded look works surprisingly well with the theme of the game, making transitions between the lighthearted character models to the much more intricate (and in some cases suitably creepy) characters used for battles seamless, on top of simply being cute. The fixed camera is at times a hassle, but for the most part works well for the style of gameplay and stays out of your mind where it belongs. I do have one odd complaint about the presentation, which is the lack of any music or sound effects for most cutscenes. Even a simple text scrolling sound would have helped, as the way it is now made them feel awkward and drawn out, not to mention greatly reduced the impact of significant plot points.  Regardless of any problems I mentioned, I wouldn't hesitate to recommend Costume Quest to anyone who has enjoyed a Double Fine game in the past. The writing is comedy gold, the characters lively and likeable, and its concept is completely unique. If you are looking for a complex and involving RPG then you won't find it here, but if you can look past the simple mechanics for the heartfelt adventure underneath it is greatly entertaining and worth playing.
2811	1	a	I'm playing crokinole with the princess of Monaco!
3818	1	a	RPG elements rolled into a fun little package. Very happy with my purchase
3412	1	a	So, I'd like to say I've been putting off buying this game for ages. Literally, ages. What happened was with the recent summer sale in June, I bought the bundle of both games for 6$. Heres what I have to say,  ++ GREAT humor and storyline, ('Gus from section 5, your wife is worried SICK.' and the kid in a banana suit who said, 'This is a total banana-fest'. LOL. ++ really lovely backgrounds,  ++also you get to choose if you wanna be a girl or boy, which was not what I was expecting when I saw 'your sister does this' and etc.,  The game itself is really short which is a bummer to me. It has four levels, but they're all long in their own way. You have to trick or treat and solve an issue in each level, and you can play hide-and-seek (well its optional actually), and they'll upgrade your trick or treat bags to cuter and cooler things, you can make optional costumes in the game which can have a big effect on your battle; (I'm not a battling kind of person, but this game was fun and cute.) Battle stamps are the best.  The Grubbin's on Ice was really interesting too, its an add on to the game's ending.  I just feel sad its a bit short for me. Just a bit over 8 hours and I've finished it with all with all achivements to boot with no guide. You shouldn't need a guide for this game! It's fun and good like that!
3191	1	a	How is this not a eSport?
4314	1	a	WONDERFUL music and it TOTALLY doesn't have anything to do with that Katamari game.
4373	0	a	DO NOT BUY THIS GAME. IT IS A TOTAL WASTE OF MONEY AND TIME. BUGGY AS CRAP and I HATE IT. &gt;:C
2283	1	a	simply addicting game! Oi, not so simple, but godamn fun! Buy it or u will cry miss this awesome game! 354/10
3261	1	a	This game is just OK, honestly. There are a lot of in-browser games that have a lot of the same mechanics as Obulis, but Obulis has a lot more levels than the in-browser ones. There's nothing mind-blowing about this game, it's just very simple.
276	1	a	My 1.7 ghz and still works. XD Great game, Quick, Simple, Fun, etc. Great music too.
160	1	a	Absolutely love this game, if you are into puzzle games this is a must get.  I havn't got extremely far into the game, but I will say it does get very challenging fast.  4.5/5 Cant give it a 5 because I havn't played it all the way through.
2449	1	a	If this was a potato it would be a good potato
4517	1	a	So actually this is a pretty well made little tycoon game. If you're down with keeping it chill sometimes, this is a nice little gem. While you may not be able to capture the feel of becoming a captain of industry with this title, it will melt your stresses away.  The idea behind the game is to cross-breed plants together so they create unique seeds. Plant the seeds and wait for them to grow to see if you've found a rare species you can farm &amp; sell.  Obviously this isnt a game for everyone but its a solid tycoon title if you can handle the subject matter.
3996	1	a	Need a game you can complete in under 10 hours and have fun? Costume Quest fits the bill nicely and it's so sweet and adorable you may get diabetes.   You control a group of trick-or-treaters that gain strength and powers based on the costumes they wear to battle evil candy stealing monsters from another dimension. You roam around the world, looking for candy, collectable cards, pieces of your costumes, and others things on a quest to save your brother or sister (the game changes based on if you play as a boy or girl).   The combat is a turn based affair with your kids gaining a special ability every 3rd turn, that based on their costume will either deal massive damage or heal or protect other teammates. It is very easy to master, and you get even more power-ups with the various stamps you collect. Towards the end game I felt the combat got slightly repetive and boring, maybe too easy for older gamers.   Even though the game is rather short, I can't really call it a negative in this case. If it went on to a 20+ hour game they would have to make a whole lot more additions to every aspect of the game. This tight little bundle of gaming is the perfect length and pacing for its content. Costume Quest is a fun and funny game to play.
3550	0	a	Do you like classic JRPGs? Yes? Then you will surely like the innovative reaction games, quick-time events and whatnot, that are required for actually winning the battles! Costume Quest really requires the hard tactical experince of a person that can understand the difficult concepts of 'a monster that heals other monsters' and 'a monster that deals high damage'. If those terms sound difficult to comprehend and you cannot understand why they should be the primary targets, you might be more at home with some lighter strategy games.
3520	1	a	One of the best games that i played in my life. Alot of adventrues and fun.
4141	1	a	An interesting match-3 type game where you actually level up your character like an RPG. Lots of fun and it is easy to get in a quick session here and there without wasting too much time.
1974	1	a	Let's get some money with this
1564	1	a	Love it. So much fun to play it with friends! Especailly thanks to the cross platform, the gameplay, and the music!
