3151	1	a	 This is a long review so if you just want a summary of why I recommend this game skip to  Results  and read from there.   IonFX makes a fun little puzzle game that produces a special world that combines Newtons three laws with gravity pushing your puzzle solving to the test. With sweet music and pleasant level design Obulis offers a deceivingly peaceful play through.    Gameplay:  After nine fearless hours I have completed Obulis. Obulis is an interesting game, but surely isnât for everyone. In the category of puzzle games Obulis tests you by using a version of physics without friction to propel, roll, jump, shoot, catapult, and bounce spheres into containers. The levels vary and there are about 152 levels. The level difficulties go from Simple to Master with everything in-between. There is no difficulty setting for the campaign so in a single play-through you will play through a various difficulty settings, which pushes you through a rather smooth difficulty curve. Each section of Obulis has an ULTRA level which unlock after completing challenges throughout the âentireâ campaign. These levels push you to the test and completing them unlocks achievements.    Features:  One of my favorite aspects of Obulis is that there is no rating for the puzzles. You either solve a puzzle or fail a puzzle, there is no score. I like this concept, but it essentially means there is no replay value to Obulis as there is nothing to do after you complete the game. The puzzles keep you on your toes, and the slowly getting more difficult challenges keep pushing you to new levels. As you progress through the chapters of the game the not only are the levels changing, but they introduce new concepts: cannons, catapults, ballista, trebuchet, gears, horizontal moving floors, vertical moving floors, and more. These concepts differentiate the puzzles and make each of the levels seem unique rather than repetitive.    Game Issues:  I write a lot about this, but if you love puzzles and like precise timing you will probably get past this quiet easily. My major gripe about this game is that the puzzles are really more based on precise timing rather than finding a solution. You may find the solution on your first attempt, but because you have to time each click perfectly youâll be sitting there for hours. When I was playing Obulis there were actually times where I went online to look at guides to see if I was solving the puzzle correct only to find out I was, but my clicks were not timed exactly perfect. On some puzzles it gets to the point where it stops being a puzzle game and it becomes more like âSports Arenaâ the arcade game made by Sammy USA Corporation where there are lights circling the border and to win prizes you must push a button right as the light next to the prize goes on. If you have never heard of this Arcade Machine you may be able to assume that itâs essentially impossible to win because of how difficult it is to time when to push the button. Obulis presents similar annoyances as âSports Arenaâ. Essentially you are just sitting there clicking a button at slightly different times to solve a puzzle you figured out the answer too quite some time ago. One of the other annoyances was that Obulis didnât always give the same result to the same physical interaction. Sometimes the ball would move slightly differently even though the same exact event was occurring. This âglitchâ sometimes resulted in me having to restart even when all the clicks were correct. Luckily if you are worrying during gameplay about whether you solved a puzzle correct and are just timing the clicks wrong there is a way to ease the pain. Go on YouTube and all the puzzles have been solved and made into videos, this can allow you to view if youâre making the mistake or not.   Results:  The tedious timing issues and the minor glitches in the physics engine didnât take away from Obulis; Obulis is actually a good play through. It offers about seven hours of puzzle solving (about two of the hours I played was with the game on pause while I was out doing other things). I recommend this game if you can get it in the Indie Puzzle Pack for a discount. I would not recommend paying full price for this game as it is essentially something youâd be able to find free elsewhere.   Pros: +Over 152 different puzzles +Fun simple puzzles with nice serene music +Comes in the Indie Puzzle Pack with a few other games +Puzzles of varying difficulty, not all puzzles have to be solved to complete the game (some of the hardest puzzles can be skipped) +Very easy controls, only requires a mouse +Puzzles vary, add new challenges, and increase in variation as you get further in the game.   Cons: -All the achievements are for completing the Ultra Puzzles -The game has some flaws in the physics engine -Most of the puzzles have obvious solutions but require tedious work to correctly time to collisions
5236	1	a	brilliant puzzle game. that seems easy at first. but brutally difficult as the game progresses.
5010	1	a	p cool game upvoted
4232	1	a	Keep them reaction skills in shape !!!!
3313	1	a	This is the first and best game to ever truly capture the spirit of why Halloween is the treasured holiday that it is. From the childlike fantasy that costumes are a transformation rather than a mask to the currency systems of candy and collectible stamps, the nostalgic whimsy is endearing and addictive.  Every year I look forward to playing this game (I have it on PS3, thus the short play hours on Steam) and whenever I need a little dose of Halloween but it's not October, this game scratches that itch.  If you love Halloween, this game embodies it like no other.
4936	1	a	10/10 FANTASTIC! Extremely highly reccomended! Exactly what I expected...Clever puzzles - numerous solved with clever tricks that would have taken ages to think of..(probably) Must Get... I can't comment on this one - I don't know what to say...Yes I do....BUY IT!   P.S. Hey everyone...Puzzle games can be replayed, you know...'oh, but I already know what happens in the story!'...Puzzle games...Its in the name - you play them because of the puzzles...Not the story...
690	1	a	Excellent game! I really enjoy playing on PC and the board game. I wish the visuals were a bit better on PC though.
653	1	a	If you enjoyed the classic board game then this is a servicable digital version. There are some issues I wish would have been addressed. Some minor bugs and lack of polish... As of this writing, it's been several months since the achivements were added to the game, and they all remain frustratingly unobtainable. In any case, the game mechanic is sound and so far there's been no game breaking issues with it. The online lobby nearly always has a few games going and matchmaking is surprisingly quick.  if you enjoy board games and want to jump into a quick match with strangers, then you could do worse than Ticket to Ride.
3236	1	a	.54 cents you can not loose. wish it was for android aswell. Good little gravity simulator. Very short but lots of replay. I'd expect addon levels coming for this title. Some really good action reaction get the ball in the cup chanlenges.
4021	1	a	Every Halloween
3566	0	a	Unfortunately, personality cannot save this game's bland and repetitive gameplay. 2/5
25	0	a	This game gave me progeria.
1569	1	a	Fun Fun Fun and for Thiefing Fun
3754	1	a	I thought this game was pretty stupid at first but after about ten minutes it became better and pretty fun. Repetitive as hell though.
3646	1	a	A fun little Halloween Theamed adventure featuring some Fun Costumes,Great Dialogue and all around a good time :3
2227	1	a	great game, totally recommended for playing.  this game is addicting !
979	0	a	One of the puzzles was broken, it lacks other gameplay elements that you usually find in other hidden object games. In this game there is dialog then you have a hidden object puzzle, pretty much all the way through the game, only a few other puzzles
4719	1	a	This game is just too much fun!
2142	1	a	Bought the four pack on sale to play with friends. Find a group of four and play through the levels. Great workshop support as well so it seems like you wont ever really run out of levels to play through. Live the graphic scheme too; very appealing.
85	1	a	This game's charm and visual style is phenomenal... But the length (about half an hour for my trip through it) is extremely jarring. I guess I sort of expected more once I realized the game's most complicated puzzle involved me needing to brush up on my music reading skills (which took longer than the length of the game to read -- although this is still better than learning to count in D'ni...)
1390	1	a	Old but gold !
5368	1	a	VERY amazing twist to Space Invaders.  I do recommend this game; however, be warned, it is fairly easy to beat.  After you beat the entire game, it will start you back at the beginning (while you can still pick up on any of your past levels at any time). BUT, this is good. Because of you missed any of the challenge mode achievements; you can go right back into achieving them.  Tons of fun. The ability to upgrade your ship is brilliant. The idea of especially the cash system overall is brilliant, and the saucer drops are brilliant.  This game was a brilliant creation, and is definitely worth the money if you are looking for an enjoyable game to let your mind get into.
1251	1	a	Games are meant to have fun, and what did I get from this game!? Fun, I got fun, not instantly though. I played this game for a good 1 hour and I immediately regretted it, so in order to redeem my gaming fun. I decided to play Call of Duty, the all superior game that beats everything, so I was playing then I realised every kill I was getting was a 360 no-scope cross map with no hitmarkers at all. Then  I realised that this game taught me how to be Faze in almost every fps game I've ever played. Now though, it's even  affected my life, whenever I pick up food from my cafeteria at school, I have to do a 360 which spills my food all the time. It's uncontrollable, I can't sleep without 360-ing continuosly in my bed. This game ruined me. I can't hug friends/family. Noone loves me anymore. I can't pay attention to school. I can't love.  Otherwise it's a great game  10/10 - Faze SpongeCake
933	1	a	Sea Cross Island was a quiet haven just off the mainland, but recently strange things have been happening! Mysterious creatures known as Fae have started appearing and are wreaking havoc. A young girl named Claudia, is thrust into adventure as she searches for her missing uncle amongst the chaos. It's a dangerous journey but she's not without friends. Four elementals are drawn to her aid as Claudia finds out that sheâs actually a sorceress! Embark on a journey to discover the secret behind the mysterious Faery Gates.
4212	1	a	This is the best out of the puzzlequest group. VERY addictive!
1090	1	a	This game is a blast. Adults and kids alike will enjoy it.
1581	1	a	I began playing this game alone, and I simply loved it. Then my brother started playing co-op with me, and i can say it is one of the best gaming experiences I've ever had. Simply a must-have for any REAL gamer
4712	1	a	If you are a sucker for 3d puzzle platformers this should be something you enjoy. Just be warned most of the puzzles are fairly easy and you need to buy the DLCs if you want something more challenging.   Rating:  Best game ever 
3463	1	a	If you would have asked me if it was possible to turn trick-or-treating into a fun video game, I would have laughed. But after playing Costume Quest, I'm simply left in awe. It is so clever, witty, and charming--a perfect game for kids or just the kid in you. The look, feel and gameplay is somewhat similar to On the Rain-slick Precipice of Darkness. There's a lot of thought that went into the costumes, quests, battle stamps, and the special attacks. I challenge all doubters to say they can't find an enjoyable game in here. Two thumbs up.
2194	1	a	Best couch co-op I've played in a long time
659	1	a	Very fun and challenging and a pretty good AI. It beats me more often than I beat it. I bet multiplayer is a blast but never have tried it. :)
2024	1	a	awesome experience unique game you have to try it it is worth it
179	1	a	        YouTubeâ¢ Video:  PirateFraser Plays... Critical Mass #UploadMonth&nbsp;
1968	1	a	i dont really like this game becuase i dont know whats going on when i play it but i like the idea and i would recomend it
3705	1	a	simple, fun, and long enough that the charm of it remains with you after finishing the game. pick it up if you want to play a short but fun RPG even if you only have a little spare time,. This game is totally managable and affordable!
2462	1	a	I really love this game How you must play through different condition But, I recommend to play this game online Because there are so many things you can do more than just play alone  So don't be hesitate, buy and play this game Regards  Kirik-Kirik
365	1	a	A fun, though a little graphics intensive, arcade shooter to play through to burn a good couple minutes off. Kinda feels like Geometry Wars+. Similar gameplay, similar attitude, more game modes.
4142	1	a	Bejeweled plus D&amp;D style gameplay, while a very frustrating and sometimes difficult game, makes this a very fun game to anyone who enjoys rpgs or puzzle games.
5374	1	a	Very nice indie game, with nostalgic controls and gameplay resembling Space Invaders. Definitely a game you should get if you're a fan of Space Invaders, or just want a casual game to play offline.
2990	1	a	sign me the â¥â¥â¥â¥ up ðððððððððð good â¥â¥â¥â¥ goà±¦Ô â¥â¥â¥â¥ð thats â some goodððâ¥â¥â¥â¥ rightððth ð ereððð rightâthere ââif i doâÆ½aÒ¯ soâmy selï½ ð¯ i say so ð¯ thats what im talking about right there right there (chorus: Ê³á¶¦áµÊ°áµ áµÊ°áµÊ³áµ) mMMMMá·Ðð¯ ðð ðÐO0Ðà¬ ï¼¯OOï¼¯OÐà¬ à¬ Ooooáµáµáµáµáµáµáµáµáµð ðð ð ð¯ ð ð ð ð ððGood â¥â¥â¥â¥
2654	1	a	This game so far is very fun should get it for fun 4 co-op family night.
3411	1	a	I originally played this on xbox 360 when DoubleFine first released it. It was interesting and I loved the atmosphere then. Now, I still love every second of it. The combat isn't ever boring and the game has great personality!
2980	1	a	its the best game everrrrrrrrrrrrrrrrrrrrrrrrrrrrrrrrrr i will bye the full vershon when it comes out  
3184	1	a	Simple, fun, semi-addicting. Exactly what you want from a casual game. It's not hard and it's enjoyable. I recommend this game, but only if you are able to buy it in a bundle or for 1 euro. It's not a game that will keep you occupied for over a day and it's definitly not worth it's full price.   The idea of the game is that you have colored balls that you will have to get into a vase which will have the same color. The physics are well made and easy to understand. The levels you have to complete in order to get achievements can be tricky but all in all it's more like a puzzle book you take out to a holiday which you could complete in a day but might just do a puzzle a day.  Fan of mediocre puzzle games? Get it. Fan of hard puzzle games? Might want to check a video on youtube about this. Fan of achievement grinding? Get it.
5509	1	a	A great Space Invaders homage. Lots of levels, 5 words, and upgrades for your defensive ship/tank thingy. 'Tis a winner, this one.
3326	1	a	If you don't want to play as a battle unicorn, I don't want to know you as a human being
2845	1	a	This game is pretty much the most amazing thing ever. Equal parts utter terror, intense frustration, careful planning, and excited exhilaration! Highly recommend; not for those who charge in without thinking, though.
3945	1	a	This game is great. There, that should do it.
4693	1	a	This games holds a variety of puzzles with a touch of creativity that makes it stand out on its own. From shifting to different dimensions, to even getting timing down to a key; this games is rather entertaining even for the roughly 7 hours it took to complete.  Overall, the game left me wanting more(2 upcoming dlcs sometime soon) and that's a good thing.
5089	0	a	It needed a bit more work. The game is essentially fine but it could have used an update or two with some important features; like being able to create farmable soil so you don't have plants randomly all over your build. Buy it at $5 or less.
1917	1	a	Okay....I'll admit it. For a long time I didn't like Monaco because it just felt strange to me. It's an acquired taste (As one of my friends said in his reviews).  But after many heists with friends, I must make a confession....I LOVE THIS BLOODY GAME!!!!!  It's not too good in single player, but when you're playing with friends, the chaos becomes your new best friend!   You can relate this game to a top-down Metal Gear game, but with a charm of it's own.   BRILLIANT story-telling. BEAUTIFUL music. WONDERFUL chaos. FUN gameplay. GREAT mechanics.  If this game is not in your library, then why are you even on Steam?!  If you meet me in a server, be ready for a good time. But don't forget........what's yours is mine!
5507	1	a	Classic Space-Invaders / Galaga with cool mouse control system, definitely worth buying for some hours of extreme fun
3647	1	a	An awesome little game, full of humor and smart dialogue that provided me with a very enjoyable gaming experience. Would definately recommend picking this up.
2324	1	a	This game is all about the multiplayer. Oceans 11 wouldn't have been as fun if it was just Ocean's 1. Pulling off the perfect caper with your team is truly fun.
3082	1	a	Played for a few hours and its already pretty fun! When I get more time definitely gonna put more hours in!
214	1	a	Pretty good time killer with a nice soundtrack.
2322	1	a	10/10
5484	1	a	Wonderful old school touch, kinda overloaded on certain levels. But enjoyable.
1731	1	a	GUARD. GUARD. Is all i â¥â¥â¥â¥ing hear. Theres no black guy in this game, so it's super unrealistic. I'm also waiting for the Zombie's mode dlc, so I can buy the RPG on the wall with chalkboard. BTW, the gentleman is gay â¥â¥â¥ â¥â¥â¥â¥â¥. He's a ripoff of spy from TF2 but hes not french, so he's not a â¥â¥â¥â¥â¥. I also like mole because it takes balls to dig a hole. Lookout is â¥â¥â¥â¥â¥â¥ character that likes to suck other's â¥â¥â¥â¥â¥ for vision.    (I do not mean all of this. Don't kill me pls)  69/10 would buy more DLC
383	1	a	Poster child of a twin stick shooter!
1117	0	a	Snuggle Truck sounds like a creepy van where you will either get murdered or â¥â¥â¥â¥â¥.
816	1	a	good game when you do not have a lot of time for gaming
4367	1	a	It's like Katamari but not as good. Worth it for cheap. Good little waste of time.
2833	1	a	great multiplayer gaming experience!
1131	1	a	Very well built physics based game. Good strong deep intellectual story line Great complex characters. I'll never forget the final boss fight.. nearly put me to tears. Highly skill based. I would not be surprised if this game was considered for MLG. Not for everyone however. The competitive edge will turn some casuals away. 10/10
4519	1	a	The concept for fish tycoon works for the man who is occupied with work and can every so often take a short break to check on things, such as social media and, in this case, virtual fish. This is not a casual experience you sit in front of and make stuff happen, this is a game were everything takes it's sweet time to do...something-anything! It does things on its own, and every so often you need to come back and make sure nothing dies. Although its not the best game, it certainly is entertaining.
5473	1	a	the game is space invaders, but with that awesome puppygames or whatever awesomeness into it, the music amazing has always, and is a challange the more you move forward, but somewhat easy considering the 2Âº time I play it, I not only beat the final boss, but was able to get the 56Âº score on the online top 100, under the name 'ALL BUSINESS*, but the game is worth, and a huge thanks for my friend (current name at time of post) Icy-Spicy for gifting it to me *huggles and wuvs &lt;3*
3001	1	a	The only problem with this game is you can't get the god damn amazing soundtrack.
1325	1	a	Real-life situations.
66	1	a	wish this game was finished!!
4817	1	a	3d puzzle games that requires you to work between dimensions, The main Story puzzles are Easy. but doing the challenges might be a bit more difficult than you think.  Did I forget to Mention the narrator is john de lancie
4122	0	a	Was interesting for the first few rounds. But then got ultra annoying because the enemy always gets better gems. Felt massively unfair and frustrating.
5311	1	a	Great puzzle game with fantastic music and graphics, but more importantly, a really interesting progression style. Think 'the alien monkeys teaching you how to wall-jump' but for every action in the game. Some very clever puzzles.
3607	1	a	TRICK OR TREAT ALL DAY
2903	1	a	Broke into a house and used their toilet. Then hid in a bush. 10/10
5495	1	a	It's Space Invaders evolved &amp; it's not pulling any punches. The game sticks with the oldtime graphics from the atari days, but adds upbeat music with challenging gameplay. A must for any retro-gamer.
3330	1	a	This helps me deal with the trauma of not being able to trick or treat as an adult. I love this game.
3044	1	a	Monaco has the foundations of a great co-op heist game. Each character has a special ability and quirky attitude, and when you have 2-4 people working together, the cooperative stealth in this game truly makes it fun. The music is absolutely delightful to listen to with the push and pull of the cautious environment. There are many different playing options in levels and style of playing too. It definitey has something great going here.  But, there is one thing I find a little annoying and odd. When I started playing, I was expecting there to be some sort of brief on each mission; map layout, special persons, particular weapons/traits, just something to predetermine some strategy. This is a heist game after all.   To be fair though it's not that big of a deal, but it would save me time in having to put up with a rather really slow and overly cautious play through, or, a hectic and rushed one, just so I can get some strategy down.  8/10
2169	1	a	Such game Much enjoy Very Monaco Omg Wow.
1032	1	a	Ok, Snuggle Truck (and Smuggle Truck) are pretty fun little games. Sometimes I like to relax with a casual game like this for a few minutes, I picked this up months ago.  But just now they added 'Brony Mode'... They snuck bronies into my Steam game collection. My Steam list is tainted forever now. Jerks.
2251	1	a	I stole everything!
5135	0	a	It's... kinda hard to describe. It's... very...... It's like a /very/ simplified Dwarf Fortress, I suppose, but with more of an emphasis on fighting and actual maps/objectives. It's not that fun, and VERY grindy.
1295	1	a	penguin arena inspired me to have a penguin fighting ring that is valued at $50,000 thank you penguin arena
220	1	a	So far I haven't played much of this game, but when I play more or the game gets an update I will edit my review as I see fit.  Waves is a twinstick shooter with the main objective of getting the highest score possible by shooting enemies.  Graphics: The graphics of this game are absolutely beautiful. Even the smallest details in this game look amazing. 10/10  Gameplay: Personally I haven't found any problems with the gameplay, it's very smooth and fast paced. This game can be played with the sticks on a gamepad, or if you prefer you can play with a mouse and keyboard. 10/10  Soundtrack: The music in this game is very nice and fits the 'environment'. 9/10  Overall: I love this game and I think it is definetily worth $5 dollars. 10/10   
3611	1	a	Love this game. Its like penny arcade meets halloween
4543	1	a	can't make them â¥â¥â¥â¥, i wanna see â¥â¥â¥â¥ in â¥â¥â¥â¥â¥ action i wanna see these little 8 bit â¥â¥â¥â¥s doing it
1561	1	a	Really wonderful retro style game. The map editor is really great too. Just buy it and start robbing like a boss!
4998	1	a	I spent hours on end shifting colors and bathing in my uncles science juices. Like young Michael Jackson.
141	1	a	I like this game. It's not a great production, the background is the same all the time and the music is annoying, but it's cool and the game modes are creative.
3834	1	a	Fun little RPG. A bit linear, but otherwise excellent. Buy, buy, buy.
5058	1	a	The puzzles are good, but tech support is nonexistent and there are a couple of areas right at the end of the game that are broken. If you're OK with a nearly-completed game, then this will occupy your mind well for a while...
